{
  "version": "metropolis-v3.0",
  "video_id": "camera_01",
  "instances_source": "instances_annot1.json",
  "frames": {
    "frame_000000": {
      "format": "png",
      "frame_number": 0,
      "instances": [
        {
          "object_id": "vehicle_01",
          "bounding_box_2d_tight": [
            450,
            320,
            650,
            520
          ],
          "occluded": false,
          "truncated": false
        },
        {
          "object_id": "vehicle_02",
          "bounding_box_2d_tight": [
            800,
            250,
            1100,
            500
          ],
          "occluded": false,
          "truncated": false
        },
        {
          "object_id": "traffic_light_01",
          "bounding_box_2d_tight": [
            850,
            180,
            920,
            280
          ],
          "occluded": false,
          "truncated": false
        }
      ]
    },
    "frame_000015": {
      "format": "png",
      "frame_number": 15,
      "instances": [
        {
          "object_id": "vehicle_01",
          "bounding_box_2d_tight": [
            450,
            320,
            650,
            520
          ],
          "occluded": false,
          "truncated": false
        },
        {
          "object_id": "vehicle_02",
          "bounding_box_2d_tight": [
            700,
            260,
            1000,
            510
          ],
          "occluded": false,
          "truncated": false
        },
        {
          "object_id": "traffic_light_01",
          "bounding_box_2d_tight": [
            850,
            180,
            920,
            280
          ],
          "occluded": false,
          "truncated": false
        }
      ]
    }
  },
  "metadata": {
    "type": "objects",
    "date": "2026-03-25",
    "description": "Object detections from auto-annotation pipeline",
    "license": "Apache-2.0",
    "tags": [
      "transportation",
      "intersection",
      "auto-pipeline"
    ]
  }
}
